{
  "schema_version": "1.0",
  "updated_at": "2026-05-12T17:25:21.659829+00:00",
  "namespaces": {
    "atributy": {
      "Kod_producenta": "Kód výrobce",
      "Kolor": "Barva",
      "Materiał": "Materiál",
      "Producent": "Výrobce",
      "Głębokość całkowita [cm]": "Hloubka [cm]",
      "Głębokość siedziska [cm]": "Hloubka sedáku [cm]",
      "Maksymalna waga obciążenia [kg]": "Nosnost [kg]",
      "Szerokość całkowita [cm]": "Šířka [cm]",
      "Szerokość siedziska [cm]": "Šířka sedáku [cm]",
      "Waga [kg]": "Hmotnost [kg]",
      "Wysokość całkowita [cm]": "Výška [cm]",
      "Wysokość do podłokietnika [cm]": "Výška k područce [cm]",
      "Wysokość do siedziska [cm]": "Výška sedáku [cm]",
      "Wysokość oparcia [cm]": "Výška opěradla [cm]",
      "EAN": "EAN",
      "material_composition": "Složení materiálu"
    },
    "hodnoty": {
      "EKO-SKÓRA": "Ekokůže",
      "MIKROFAZA": "Mikrovlákno",
      "VELVET": "Samet",
      "100% PVC": "100% PVC",
      "100% Poliester": "100% Polyester"
    },
    "kategorie": {
      "FOTEL MILO": "Křeslo Milo",
      "FOTEL MILO ECO SKÓRA , SKAJ": "Křeslo Milo ekokůže, koženka",
      "FOTEL MILO MIKROFAZA": "Křeslo Milo mikrovlákno",
      "FOTEL MILO NOGI 15 BIAŁE": "Křeslo Milo nohy 15 cm bílé",
      "FOTEL MILO NOGI 15 BUK": "Křeslo Milo nohy 15 cm buk",
      "FOTEL MILO NOGI 15 VENGE": "Křeslo Milo nohy 15 cm wenge",
      "FOTEL MILO NOGI 20 BIAŁE": "Křeslo Milo nohy 20 cm bílé",
      "FOTEL MILO NOGI 20 BUK": "Křeslo Milo nohy 20 cm buk",
      "FOTEL MILO NOGI 20 VENGE": "Křeslo Milo nohy 20 cm wenge",
      "FOTEL MILO NOGI BIAŁE": "Křeslo Milo nohy bílé",
      "FOTEL MILO NOGI BUK": "Křeslo Milo nohy buk",
      "FOTEL MILO NOGI CHROM": "Křeslo Milo nohy chrom",
      "FOTEL MILO NOGI VENGE": "Křeslo Milo nohy wenge",
      "FOTELE": "Křesla",
      "Fotel Milo tapicerowany tkaniną velvet – 19 kolorów": "Křeslo Milo čalouněné látkou samet – 19 barev",
      "SOFA MILO": "Pohovka Milo",
      "SOFA MILO NOGA 20 BIAŁA": "Pohovka Milo noha 20 cm bílá",
      "SOFA MILO NOGA 20 VENGE": "Pohovka Milo noha 20 cm wenge",
      "SOFA MILO NOGI 15 BIAŁE": "Pohovka Milo nohy 15 cm bílé",
      "SOFA MILO NOGI 15 BUK": "Pohovka Milo nohy 15 cm buk",
      "SOFA MILO NOGI 15 VENGE": "Pohovka Milo nohy 15 cm wenge",
      "SOFA MILO NOGI 20 BUK": "Pohovka Milo nohy 20 cm buk",
      "SOFA MILO NOGI CHROM": "Pohovka Milo nohy chrom",
      "SOFA MILO VELVET": "Pohovka Milo samet",
      "SOFY": "Pohovky"
    },
    "barvy_kody": {
      "BL06": {
        "pl": null,
        "cz": "sedomodra",
        "material": "Velvet"
      },
      "BL14": {
        "pl": null,
        "cz": "seda",
        "material": "Velvet"
      },
      "BL75": {
        "pl": "olive",
        "cz": "olivove zelena",
        "material": "Velvet"
      },
      "MG02": {
        "pl": "sliwka",
        "cz": "svestkova",
        "material": "Velvet"
      },
      "MG05": {
        "pl": null,
        "cz": "hneda",
        "material": "Velvet"
      },
      "MG06": {
        "pl": null,
        "cz": "svetle hneda",
        "material": "Velvet"
      },
      "MG09": {
        "pl": null,
        "cz": "sedobezova",
        "material": "Velvet"
      },
      "MG15": {
        "pl": null,
        "cz": "medova",
        "material": "Velvet"
      },
      "MG16": {
        "pl": null,
        "cz": "tmave modra",
        "material": "Velvet"
      },
      "MG17": {
        "pl": null,
        "cz": "seda",
        "material": "Velvet"
      },
      "MG19": {
        "pl": null,
        "cz": "cerna",
        "material": "Velvet"
      },
      "MG20": {
        "pl": null,
        "cz": "tyrkysova",
        "material": "Velvet"
      },
      "MG25": {
        "pl": null,
        "cz": "lahvove zelena",
        "material": "Velvet"
      },
      "MG31": {
        "pl": null,
        "cz": "cervena",
        "material": "Velvet"
      },
      "MG33": {
        "pl": null,
        "cz": "modra",
        "material": "Velvet"
      },
      "MG39": {
        "pl": null,
        "cz": "svetle seda",
        "material": "Velvet"
      },
      "MG50": {
        "pl": null,
        "cz": "kremova",
        "material": "Velvet"
      },
      "MG55": {
        "pl": null,
        "cz": "sedoruzova",
        "material": "Velvet"
      },
      "MG58": {
        "pl": null,
        "cz": "indicka ruzova",
        "material": "Velvet"
      },
      "1 MIKROFAZA": {
        "pl": "jasny bez",
        "cz": "svetle bezova",
        "material": "Mikrofaze"
      },
      "2 MIKROFAZA": {
        "pl": "bez",
        "cz": "bezova",
        "material": "Mikrofaze"
      },
      "3 MIKROFAZA": {
        "pl": "jasny braz",
        "cz": "svetle hneda",
        "material": "Mikrofaze"
      },
      "4 MIKROFAZA": {
        "pl": "braz",
        "cz": "hneda",
        "material": "Mikrofaze"
      },
      "5 MIKROFAZA": {
        "pl": "carrot",
        "cz": "mrkvova",
        "material": "Mikrofaze"
      },
      "6 MIKROFAZA": {
        "pl": "cegla",
        "cz": "cihlova",
        "material": "Mikrofaze"
      },
      "8 MIKROFAZA": {
        "pl": "czerwony",
        "cz": "cervena",
        "material": "Mikrofaze"
      },
      "9 MIKROFAZA": {
        "pl": "zielen lesna",
        "cz": "lesni zelena",
        "material": "Mikrofaze"
      },
      "10 MIKROFAZA": {
        "pl": "rozowy",
        "cz": "ruzova",
        "material": "Mikrofaze"
      },
      "11 MIKROFAZA": {
        "pl": "fioletowy",
        "cz": "fialova",
        "material": "Mikrofaze"
      },
      "12 MIKROFAZA": {
        "pl": "zielony",
        "cz": "zelena",
        "material": "Mikrofaze"
      },
      "15 MIKROFAZA": {
        "pl": "chabrowy",
        "cz": "chrpove modra",
        "material": "Mikrofaze"
      },
      "16 MIKROFAZA": {
        "pl": "granatowy",
        "cz": "tmave modra",
        "material": "Mikrofaze"
      },
      "17 MIKROFAZA": {
        "pl": "szary",
        "cz": "seda",
        "material": "Mikrofaze"
      },
      "18 MIKROFAZA": {
        "pl": "czarny",
        "cz": "cerna",
        "material": "Mikrofaze"
      },
      "1D": {
        "pl": "czarny",
        "cz": "cerna",
        "material": "Eko-kuze"
      },
      "2D": {
        "pl": "braz",
        "cz": "hneda",
        "material": "Eko-kuze"
      },
      "3D": {
        "pl": "jasny braz",
        "cz": "svetle hneda",
        "material": "Eko-kuze"
      },
      "4D": {
        "pl": "granatowy",
        "cz": "tmave modra",
        "material": "Eko-kuze"
      },
      "5D": {
        "pl": "limonka",
        "cz": "limetkova",
        "material": "Eko-kuze"
      },
      "6D": {
        "pl": "zielony",
        "cz": "zelena",
        "material": "Eko-kuze"
      },
      "7D": {
        "pl": "seledynowy",
        "cz": "celadonova",
        "material": "Eko-kuze"
      },
      "10D": {
        "pl": "biala",
        "cz": "bila",
        "material": "Eko-kuze"
      },
      "11D": {
        "pl": "buk",
        "cz": "bukova",
        "material": "Eko-kuze"
      },
      "14D": {
        "pl": "olcha",
        "cz": "olsova",
        "material": "Eko-kuze"
      },
      "15D": {
        "pl": "czerwony",
        "cz": "cervena",
        "material": "Eko-kuze"
      },
      "18D": {
        "pl": "wanilia",
        "cz": "vanilkova",
        "material": "Eko-kuze"
      },
      "19D": {
        "pl": "venge",
        "cz": "wenge",
        "material": "Eko-kuze"
      },
      "20D": {
        "pl": "pomaranczowy",
        "cz": "oranzova",
        "material": "Eko-kuze"
      },
      "22D": {
        "pl": "szary",
        "cz": "seda",
        "material": "Eko-kuze"
      },
      "23D": {
        "pl": "szary",
        "cz": "seda",
        "material": "Eko-kuze"
      },
      "BRINGHTON 2": {
        "pl": "Brighton 2",
        "cz": "Brighton 2",
        "material": "Tkanina"
      },
      "SNIKERS 1": {
        "pl": "Snikers 1 szary",
        "cz": "Snikers 1 seda",
        "material": "Tkanina"
      },
      "TRIP 2": {
        "pl": "Trip 2",
        "cz": "Trip 2",
        "material": "Tkanina"
      }
    }
  },
  "per_kategorii_override": {},
  "audit": {
    "BL06": {
      "_source": "seed_utuli",
      "_updated_at": "2026-05-12T11:26:14.246313+00:00"
    },
    "BL14": {
      "_source": "seed_utuli",
      "_updated_at": "2026-05-12T11:26:14.246313+00:00"
    },
    "BL75": {
      "_source": "seed_utuli",
      "_updated_at": "2026-05-12T11:26:14.246313+00:00"
    },
    "MG02": {
      "_source": "seed_utuli",
      "_updated_at": "2026-05-12T11:26:14.246313+00:00"
    },
    "MG05": {
      "_source": "seed_utuli",
      "_updated_at": "2026-05-12T11:26:14.246313+00:00"
    },
    "MG06": {
      "_source": "seed_utuli",
      "_updated_at": "2026-05-12T11:26:14.246313+00:00"
    },
    "MG09": {
      "_source": "seed_utuli",
      "_updated_at": "2026-05-12T11:26:14.246313+00:00"
    },
    "MG15": {
      "_source": "seed_utuli",
      "_updated_at": "2026-05-12T11:26:14.246313+00:00"
    },
    "MG16": {
      "_source": "seed_utuli",
      "_updated_at": "2026-05-12T11:26:14.246313+00:00"
    },
    "MG17": {
      "_source": "seed_utuli",
      "_updated_at": "2026-05-12T11:26:14.246313+00:00"
    },
    "MG19": {
      "_source": "seed_utuli",
      "_updated_at": "2026-05-12T11:26:14.246313+00:00"
    },
    "MG20": {
      "_source": "seed_utuli",
      "_updated_at": "2026-05-12T11:26:14.246313+00:00"
    },
    "MG25": {
      "_source": "seed_utuli",
      "_updated_at": "2026-05-12T11:26:14.246313+00:00"
    },
    "MG31": {
      "_source": "seed_utuli",
      "_updated_at": "2026-05-12T11:26:14.246313+00:00"
    },
    "MG33": {
      "_source": "seed_utuli",
      "_updated_at": "2026-05-12T11:26:14.246313+00:00"
    },
    "MG39": {
      "_source": "seed_utuli",
      "_updated_at": "2026-05-12T11:26:14.246313+00:00"
    },
    "MG50": {